{
  "slug": "perfume",
  "brand": "Maison Rosé",
  "product": "a faceted rectangular glass perfume bottle filled with pale pink liquid, a polished rose-gold cap, and a small embossed 'MAISON ROSÉ' label",
  "product_short": "the MAISON ROSÉ glass perfume bottle",
  "product_he": "בקבוק הבושם",
  "website": "a minimal luxury perfume website: a blush-pink hero banner, the serif logo 'MAISON ROSÉ', a large drawing of the perfume bottle, and the giant editorial headline 'PINK'",
  "hero_word": "PINK",
  "letter_material": "matte blush-pink plaster with softly rounded edges",
  "emergence": "the glass bottle slowly pushes out through the screen, the screen surface stretching around it like a membrane of liquid light before releasing it onto the table",
  "transformation": "a soft pink perfume mist escapes from the bottle and transforms into blooming peonies and roses that grow through and around the giant letters as the camera moves closer",
  "transformation_he": "ערפל בושם ורוד בורח מהבקבוק והופך לאדמוניות ושושנים שפורחות דרך האותיות",
  "particles": "pink perfume mist, drifting rose petals",
  "accent_color": "blush pink and rose gold",
  "accent_hex": "#C9748A",
  "text_hex": "#3A2228",
  "hero_shot": "the perfume bottle standing centered on the oak table among a few fresh peonies, a soft pink mist halo behind it, rose-gold cap catching the light",
  "tagline": "PINK YOUR LIFE",
  "image_route": "gpt",
  "typography_mode": "hybrid",
  "look": "hyperreal",
  "drawn_mode": "both",
  "drawn_style": "fine blush-pink ink line art, elegant fashion-illustration strokes"
}