{
  "slug": "coffee",
  "brand": "Terra Roast",
  "product": "a matte terracotta-coloured kraft coffee bag with a brass clip and a debossed 'TERRA ROAST' label, accompanied by a brass hand coffee grinder",
  "product_short": "the brass coffee grinder and the TERRA ROAST bag",
  "product_he": "שקית הקפה ומטחנת הפליז",
  "website": "an artisan coffee roastery website in beige and terracotta: a photo of roasted beans, the serif logo 'TERRA ROAST', and the giant editorial headline 'GRIND'",
  "hero_word": "GRIND",
  "letter_material": "hand-carved terracotta clay with a raw matte texture",
  "emergence": "a cascade of glossy roasted coffee beans pours out of the screen like a waterfall onto the oak table, followed by the brass grinder sliding out of the website",
  "transformation": "the grinder turns by itself and a stream of fresh espresso pours through the hollow letters like a sculpted fountain, the steam curling into warm morning sunbeams",
  "transformation_he": "המטחנה מסתובבת לבד, אספרסו נשפך דרך האותיות כמו מזרקה והאדים הופכים לקרני אור של בוקר",
  "particles": "falling coffee beans, coffee grounds, curling steam",
  "accent_color": "terracotta and dark espresso brown",
  "accent_hex": "#B5523B",
  "text_hex": "#2A1E17",
  "hero_shot": "a handmade ceramic cup of fresh espresso with crema, the TERRA ROAST bag and a few beans on a linen cloth, steam rising in the morning light",
  "tagline": "SLOW MORNINGS",
  "image_route": "gpt",
  "typography_mode": "hybrid",
  "look": "hyperreal",
  "drawn_mode": "sketch-to-real",
  "drawn_style": "warm graphite pencil sketch with loose hatching"
}